{"legislative_session": "2025", "identifier": "HB2", "title": "relative to state fees, funds, revenues, and expenditures.", "from_organization": "~{\"classification\": \"lower\"}", "classification": ["bill"], "subject": [], "abstracts": [], "other_titles": [], "other_identifiers": [], "actions": [{"description": "Introduced (in recess of) 02/20/2025 and referred to Finance  HJ 6  P. 53", "date": "2025-03-03", "organization_id": "~{\"classification\": \"lower\"}", "classification": ["introduction", "referral-committee"], "related_entities": []}, {"description": "Public Hearing: 03/12/2025 02:00 pm SH Reps Hall", "date": "2025-03-05", "organization_id": "~{\"classification\": \"lower\"}", "classification": [], "related_entities": []}, {"description": "==RECESSED== Executive Session: 03/31/2025 10:00 am LOB 210-211", "date": "2025-03-25", "organization_id": "~{\"classification\": \"lower\"}", "classification": [], "related_entities": []}, {"description": "==CONTINUED== Executive Session: 04/03/2025 01:00 pm LOB 210-211", "date": "2025-03-26", "organization_id": "~{\"classification\": \"lower\"}", "classification": [], "related_entities": []}, {"description": "Majority Committee Report: Ought to Pass with Amendment # 2025-1488h   04/03/2025 (Vote 14-11; RC)  HC 19  P. 19", "date": "2025-04-03", "organization_id": "~{\"classification\": \"lower\"}", "classification": ["committee-passage-favorable"], "related_entities": []}, {"description": "Minority Committee Report: Inexpedient to Legislate", "date": "2025-04-03", "organization_id": "~{\"classification\": \"lower\"}", "classification": [], "related_entities": []}, {"description": "Amendment # 2025-1488h: AA RC 200-175 04/10/2025  HJ 12  P. 56", "date": "2025-04-10", "organization_id": "~{\"classification\": \"lower\"}", "classification": [], "related_entities": []}, {"description": "Amendment # 2025-1529h: AA RC 203-169 04/10/2025  HJ 12  P. 58", "date": "2025-04-10", "organization_id": "~{\"classification\": \"lower\"}", "classification": [], "related_entities": []}, {"description": "Amendment # 2025-1559h: AA VV 04/10/2025  HJ 12  P. 63", "date": "2025-04-10", "organization_id": "~{\"classification\": \"lower\"}", "classification": [], "related_entities": []}, {"description": "Amendment # 2025-1560h: AA RC 203-167 04/10/2025  HJ 12  P. 67", "date": "2025-04-10", "organization_id": "~{\"classification\": \"lower\"}", "classification": [], "related_entities": []}, {"description": "Amendment # 2025-1526h: AA RC 195-175 04/10/2025  HJ 12  P. 65", "date": "2025-04-10", "organization_id": "~{\"classification\": \"lower\"}", "classification": [], "related_entities": []}, {"description": "Amendment # 2025-1555h: AF RC 104-268 04/10/2025  HJ 12  P. 71", "date": "2025-04-10", "organization_id": "~{\"classification\": \"lower\"}", "classification": [], "related_entities": []}, {"description": "Amendment # 2025-1543h: AF RC 166-204 04/10/2025  HJ 12  P. 73", "date": "2025-04-10", "organization_id": "~{\"classification\": \"lower\"}", "classification": [], "related_entities": []}, {"description": "Amendment # 2025-1512h: AF DV 28-341 04/10/2025  HJ 12  P. 84", "date": "2025-04-10", "organization_id": "~{\"classification\": \"lower\"}", "classification": [], "related_entities": []}, {"description": "Amendment # 2025-1499h: AA RC 206-165 04/10/2025  HJ 12  P. 85", "date": "2025-04-10", "organization_id": "~{\"classification\": \"lower\"}", "classification": [], "related_entities": []}, {"description": "Amendment # 2025-1501h: AF RC 174-196 04/10/2025  HJ 12  P. 87", "date": "2025-04-10", "organization_id": "~{\"classification\": \"lower\"}", "classification": [], "related_entities": []}, {"description": "Amendment # 2025-1503h: AF RC 177-190 04/10/2025  HJ 12  P. 89", "date": "2025-04-10", "organization_id": "~{\"classification\": \"lower\"}", "classification": [], "related_entities": []}, {"description": "Amendment # 2025-1523h: AA RC 198-169 04/10/2025  HJ 12  P. 92", "date": "2025-04-10", "organization_id": "~{\"classification\": \"lower\"}", "classification": [], "related_entities": []}, {"description": "Amendment # 2025-1569h: AA RC 183-180 04/10/2025  HJ 12  P. 94", "date": "2025-04-10", "organization_id": "~{\"classification\": \"lower\"}", "classification": [], "related_entities": []}, {"description": "Amendment # 2025-1561h: AF RC 181-182 04/10/2025  HJ 12  P. 97", "date": "2025-04-10", "organization_id": "~{\"classification\": \"lower\"}", "classification": [], "related_entities": []}, {"description": "Amendment # 2025-1553h: AF RC 177-185 04/10/2025  HJ 12  P. 100", "date": "2025-04-10", "organization_id": "~{\"classification\": \"lower\"}", "classification": [], "related_entities": []}, {"description": "Amendment # 2025-1566h: AA RC 183-177 04/10/2025  HJ 12  P. 103", "date": "2025-04-10", "organization_id": "~{\"classification\": \"lower\"}", "classification": [], "related_entities": []}, {"description": "Lay HB2 on Table (Rep. Granger): MA DV 198-167 04/10/2025  HJ 12  P. 105", "date": "2025-04-10", "organization_id": "~{\"classification\": \"lower\"}", "classification": ["deferral"], "related_entities": []}, {"description": "Remove from Table (Rep. Granger): MA RC 193-170 04/10/2025  HJ 12  P. 105", "date": "2025-04-10", "organization_id": "~{\"classification\": \"lower\"}", "classification": [], "related_entities": []}, {"description": "Previous Question Rep. Sweeney MA RC 193-171  HJ 12  P. 107", "date": "2025-04-10", "organization_id": "~{\"classification\": \"lower\"}", "classification": [], "related_entities": []}, {"description": "Amendment # 2025-1525h: AF RC 166-198 04/10/2025  HJ 12  P. 109", "date": "2025-04-10", "organization_id": "~{\"classification\": \"lower\"}", "classification": [], "related_entities": []}, {"description": "Amendment # 2025-1545h: AF RC 166-198 04/10/2025  HJ 12  P. 112", "date": "2025-04-10", "organization_id": "~{\"classification\": \"lower\"}", "classification": [], "related_entities": []}, {"description": "Amendment # 2025-1517h: AF RC 173-191 04/10/2025  HJ 12  P. 114", "date": "2025-04-10", "organization_id": "~{\"classification\": \"lower\"}", "classification": [], "related_entities": []}, {"description": "Amendment # 2025-1546h: AF RC 159-205 04/10/2025  HJ 12  P. 116", "date": "2025-04-10", "organization_id": "~{\"classification\": \"lower\"}", "classification": [], "related_entities": []}, {"description": "Amendment # 2025-1513h: AA RC 183-181 04/10/2025  HJ 12  P. 118", "date": "2025-04-10", "organization_id": "~{\"classification\": \"lower\"}", "classification": [], "related_entities": []}, {"description": "Amendment # 2025-1516h: AF RC 116-248 04/10/2025  HJ 12  P. 121", "date": "2025-04-10", "organization_id": "~{\"classification\": \"lower\"}", "classification": [], "related_entities": []}, {"description": "Amendment # 2025-1550h: AF RC 169-195 04/10/2025  HJ 12  P. 123", "date": "2025-04-10", "organization_id": "~{\"classification\": \"lower\"}", "classification": [], "related_entities": []}, {"description": "Amendment # 2025-1567h: AF RC 165-198 04/10/2025  HJ 12  P. 125", "date": "2025-04-10", "organization_id": "~{\"classification\": \"lower\"}", "classification": [], "related_entities": []}, {"description": "Amendment # 2025-1549h: AF RC 161-203 04/10/2025  HJ 12  P. 131", "date": "2025-04-10", "organization_id": "~{\"classification\": \"lower\"}", "classification": [], "related_entities": []}, {"description": "Ought to Pass with Amendment 2025-1488h 2025-1529h 2025-1559h 2025-1526h 2025-1560h 2025-1499h 2025-1523h 2025-1569h 2025-1566h and 2025-1513h: MA RC 185-175 04/10/2025  HJ 12  P. 133", "date": "2025-04-10", "organization_id": "~{\"classification\": \"lower\"}", "classification": ["committee-passage-favorable", "passage"], "related_entities": []}, {"description": "Without Objection the clerk is authorized to make technical and administrative corrections which are necessary to reflect the intent of the House MA; 04/10/2025  HJ 12  P. 135", "date": "2025-04-11", "organization_id": "~{\"classification\": \"lower\"}", "classification": [], "related_entities": []}, {"description": "Introduced 03/27/2025 and Referred to Finance;  SJ 10", "date": "2025-04-14", "organization_id": "~{\"classification\": \"upper\"}", "classification": ["introduction", "referral-committee"], "related_entities": []}, {"description": "Hearing: 05/06/2025, Room Reps Hall, SH, 01:00 pm;  SC 19", "date": "2025-04-24", "organization_id": "~{\"classification\": \"upper\"}", "classification": [], "related_entities": []}, {"description": "Committee Report: Ought to Pass with Amendment # 2025-2637s, 06/05/2025, Vote 6-2;  SC 24A", "date": "2025-06-03", "organization_id": "~{\"classification\": \"upper\"}", "classification": ["committee-passage-favorable"], "related_entities": []}, {"description": "The Chair ruled the Question Divisible; 06/05/2025;  SJ 15", "date": "2025-06-05", "organization_id": "~{\"classification\": \"upper\"}", "classification": [], "related_entities": []}, {"description": "Sen. Birdsell Objected that the Question is Divisible; 06/05/2025;  SJ 15", "date": "2025-06-05", "organization_id": "~{\"classification\": \"upper\"}", "classification": [], "related_entities": []}, {"description": "Committee Amendment # 2025-2637s, AA, VV; 06/05/2025;  SJ 15", "date": "2025-06-05", "organization_id": "~{\"classification\": \"upper\"}", "classification": [], "related_entities": []}, {"description": "Sen. Birdsell Floor Amendment # 2025-2670s, AA, VV; 06/05/2025;  SJ 15", "date": "2025-06-05", "organization_id": "~{\"classification\": \"upper\"}", "classification": [], "related_entities": []}, {"description": "Sen. Gray Floor Amendment # 2025-2697s, AA, VV; 06/05/2025;  SJ 15", "date": "2025-06-05", "organization_id": "~{\"classification\": \"upper\"}", "classification": [], "related_entities": []}, {"description": "Sen. Rochefort Floor Amendment # 2025-2647s, RC 9Y-15N, AF; 06/05/2025;  SJ 15", "date": "2025-06-05", "organization_id": "~{\"classification\": \"upper\"}", "classification": [], "related_entities": []}, {"description": "Sen. McGough Floor Amendment # 2025-2705s, AA, VV; 06/05/2025;  SJ 15", "date": "2025-06-05", "organization_id": "~{\"classification\": \"upper\"}", "classification": [], "related_entities": []}, {"description": "Sen. Rosenwald Floor Amendment # 2025-2660s, RC 8Y-16N, AF; 06/05/2025;  SJ 15", "date": "2025-06-05", "organization_id": "~{\"classification\": \"upper\"}", "classification": [], "related_entities": []}, {"description": "Special Order to beginning of the regular calendar, Without Objection, MA; 06/05/2025;  SJ 15", "date": "2025-06-05", "organization_id": "~{\"classification\": \"upper\"}", "classification": [], "related_entities": []}, {"description": "Shall the decision of the Chair stand? RC 8Y-16N decision of the Chair overturned, 06/05/2025;  SJ 15", "date": "2025-06-05", "organization_id": "~{\"classification\": \"upper\"}", "classification": [], "related_entities": []}, {"description": "Sen. Prentiss Floor Amendment # 2025-2679s, RC 8Y-16N, AF; 06/05/2025;  SJ 15", "date": "2025-06-05", "organization_id": "~{\"classification\": \"upper\"}", "classification": [], "related_entities": []}, {"description": "Sen. Perkins Kwoka Floor Amendment # 2025-2664s, RC 8Y-16N, AF; 06/05/2025;  SJ 15", "date": "2025-06-05", "organization_id": "~{\"classification\": \"upper\"}", "classification": [], "related_entities": []}, {"description": "Sen. Reardon Floor Amendment # 2025-2683s, RC 8Y-16N, AF; 06/05/2025;  SJ 15", "date": "2025-06-05", "organization_id": "~{\"classification\": \"upper\"}", "classification": [], "related_entities": []}, {"description": "Sen. Fenton Floor Amendment # 2025-2662s, RC 8Y-16N, AF; 06/05/2025;  SJ 15", "date": "2025-06-05", "organization_id": "~{\"classification\": \"upper\"}", "classification": [], "related_entities": []}, {"description": "Sen. Rosenwald Floor Amendment # 2025-2671s, RC 8Y-16N, AF; 06/05/2025;  SJ 15", "date": "2025-06-05", "organization_id": "~{\"classification\": \"upper\"}", "classification": [], "related_entities": []}, {"description": "Sen. Rosenwald Floor Amendment # 2025-2648s, RC 8Y-16N, AF; 06/05/2025;  SJ 15", "date": "2025-06-05", "organization_id": "~{\"classification\": \"upper\"}", "classification": [], "related_entities": []}, {"description": "Sen. Prentiss Floor Amendment # 2025-2672s, RC 8Y-16N, AF; 06/05/2025;  SJ 15", "date": "2025-06-05", "organization_id": "~{\"classification\": \"upper\"}", "classification": [], "related_entities": []}, {"description": "Sen. Long Floor Amendment # 2025-2669s, RC 8Y-16N, AF; 06/05/2025;  SJ 15", "date": "2025-06-05", "organization_id": "~{\"classification\": \"upper\"}", "classification": [], "related_entities": []}, {"description": "Sen. Long Floor Amendment # 2025-2714s, RC 9Y-15N, AF; 06/05/2025;  SJ 15", "date": "2025-06-05", "organization_id": "~{\"classification\": \"upper\"}", "classification": [], "related_entities": []}, {"description": "Sen. Altschiller Floor Amendment # 2025-2675s, RC 8Y-16N, AF; 06/05/2025;  SJ 15", "date": "2025-06-05", "organization_id": "~{\"classification\": \"upper\"}", "classification": [], "related_entities": []}, {"description": "Sen. Rosenwald Floor Amendment # 2025-2703s, RC 8Y-16N, AF; 06/05/2025;  SJ 15", "date": "2025-06-05", "organization_id": "~{\"classification\": \"upper\"}", "classification": [], "related_entities": []}, {"description": "Ought to Pass with Amendments #2025-2637s, and #2025-2670s #2025-2697s #2025-2705s, RC 14Y-10N, MA; OT3rdg; 06/05/2025;  SJ 15", "date": "2025-06-05", "organization_id": "~{\"classification\": \"upper\"}", "classification": ["committee-passage-favorable", "passage"], "related_entities": []}, {"description": "House Non-Concurs with Senate Amendment  2025-2637s 2025-2670s 2025-2697s and 2025-2705s and Requests CofC (Rep. Osborne): MA VV 06/05/2025  HJ 16  P. 167", "date": "2025-06-09", "organization_id": "~{\"classification\": \"lower\"}", "classification": [], "related_entities": []}, {"description": "Speaker Appoints: Reps. Weyler, D. McGuire, Sweeney, Cambrils, Wallner 06/05/2025  HJ 16  P. 167", "date": "2025-06-09", "organization_id": "~{\"classification\": \"lower\"}", "classification": [], "related_entities": []}, {"description": "Speaker Appoints Alternates: Reps. Erf, Layon, Edwards, Osborne, Janigian 06/05/2025  HJ 16  P. 167", "date": "2025-06-09", "organization_id": "~{\"classification\": \"lower\"}", "classification": [], "related_entities": []}, {"description": "Sen. Carson Accedes to House Request for Committee of Conference, MA, VV; (In recess 06/05/2025);  SJ 16", "date": "2025-06-09", "organization_id": "~{\"classification\": \"upper\"}", "classification": [], "related_entities": []}, {"description": "President Appoints: Senators Carson, Gray, Rosenwald; (In Recess 06/05/2025);  SJ 16", "date": "2025-06-09", "organization_id": "~{\"classification\": \"upper\"}", "classification": [], "related_entities": []}, {"description": "President Appoints Alternates: Senators Birdsell; (In Recess 06/05/2025);  SJ 16", "date": "2025-06-09", "organization_id": "~{\"classification\": \"upper\"}", "classification": [], "related_entities": []}, {"description": "Conference Committee Meeting: 06/12/2025 02:00 pm LOB 210-211", "date": "2025-06-12", "organization_id": "~{\"classification\": \"lower\"}", "classification": [], "related_entities": []}, {"description": "Conferee Change: Rep. Mooney Replaces Rep. Edwards 06/12/2025  HJ 16  P. 173", "date": "2025-06-12", "organization_id": "~{\"classification\": \"lower\"}", "classification": [], "related_entities": []}, {"description": "Conference Committee Meeting: 06/13/2025 10:00 am LOB 210-211", "date": "2025-06-13", "organization_id": "~{\"classification\": \"lower\"}", "classification": [], "related_entities": []}, {"description": "President Appoints Alternates: Senators Lang; (In Recess 06/12/2025);  SJ 17", "date": "2025-06-12", "organization_id": "~{\"classification\": \"upper\"}", "classification": [], "related_entities": []}, {"description": "President Appoints Alternates: Senators Reardon; (In Recess 06/12/2025);  SJ 17", "date": "2025-06-13", "organization_id": "~{\"classification\": \"upper\"}", "classification": [], "related_entities": []}, {"description": "Conference Committee Meeting: 06/16/2025 10:00 am LOB 210-211", "date": "2025-06-16", "organization_id": "~{\"classification\": \"lower\"}", "classification": [], "related_entities": []}, {"description": "Conferee Change: Rep. Edwards Replaces Rep.Mooney 06/13/2025  HJ 17  P. 23", "date": "2025-06-19", "organization_id": "~{\"classification\": \"lower\"}", "classification": [], "related_entities": []}, {"description": "Conferee Change: Rep. Edwards Replaces Rep. Mooney 06/16/2025  HJ 17  P. 26", "date": "2025-06-16", "organization_id": "~{\"classification\": \"lower\"}", "classification": [], "related_entities": []}, {"description": "Conference Committee Meeting: 06/17/2025 10:00 am LOB 210-211", "date": "2025-06-17", "organization_id": "~{\"classification\": \"lower\"}", "classification": [], "related_entities": []}, {"description": "Conference Committee Meeting: 06/17/2025 10:00 am LOB 210-211", "date": "2025-06-17", "organization_id": "~{\"classification\": \"lower\"}", "classification": [], "related_entities": []}, {"description": "Conference Committee Meeting: 06/18/2025 10:00 am LOB 210-211", "date": "2025-06-18", "organization_id": "~{\"classification\": \"lower\"}", "classification": [], "related_entities": []}, {"description": "Conferee Change; Senator Birdsell Replaces Senator Rosenwald;  SJ 17", "date": "2025-06-18", "organization_id": "~{\"classification\": \"upper\"}", "classification": [], "related_entities": []}, {"description": "Conference Committee Meeting: 06/19/2025 10:00 am LOB 210-211", "date": "2025-06-19", "organization_id": "~{\"classification\": \"lower\"}", "classification": [], "related_entities": []}, {"description": "Conferee Change: Rep. Edwards Replaces Rep.Wallner 06/19/2025  HJ 17  P. 26", "date": "2025-06-19", "organization_id": "~{\"classification\": \"lower\"}", "classification": [], "related_entities": []}, {"description": "Conference Committee Report Filed, # 2025-2871c; 06/26/2025", "date": "2025-06-19", "organization_id": "~{\"classification\": \"upper\"}", "classification": [], "related_entities": []}, {"description": "Conference Committee Report 2025-2871c: Adopted, RC 184-183 06/26/2025  HJ 18  P. 42", "date": "2025-06-26", "organization_id": "~{\"classification\": \"lower\"}", "classification": [], "related_entities": []}, {"description": "Conference Committee Report # 2025-2871c; RC 16Y-8N, Adopted; 06/26/2025;  SJ 17", "date": "2025-06-26", "organization_id": "~{\"classification\": \"upper\"}", "classification": [], "related_entities": []}, {"description": "Lay HB2 on Table (Rep. Osborne): MA VV 06/26/2025  HJ 18  P. 32", "date": "2025-06-26", "organization_id": "~{\"classification\": \"lower\"}", "classification": ["deferral"], "related_entities": []}, {"description": "Remove from Table (Rep. Osborne): MA RC 185-180 06/26/2025  HJ 18  P. 38", "date": "2025-06-26", "organization_id": "~{\"classification\": \"lower\"}", "classification": [], "related_entities": []}, {"description": "Rep. Sweeney moves Previous Question MA RC 193-173 06/26/2025  HJ 18  P. 40", "date": "2025-06-26", "organization_id": "~{\"classification\": \"lower\"}", "classification": [], "related_entities": []}, {"description": "Enrolled Bill Amendment # 2025-2900e: AA VV (in recess of) 06/26/2025  HJ 18  P. 58", "date": "2025-06-27", "organization_id": "~{\"classification\": \"lower\"}", "classification": [], "related_entities": []}, {"description": "Enrolled Bill Amendment # 2025-2900e Adopted, VV, (In recess of 06/26/2025);  SJ 18", "date": "2025-06-27", "organization_id": "~{\"classification\": \"upper\"}", "classification": ["amendment-passage"], "related_entities": []}, {"description": "Enrolled (in recess of) 06/26/2025  HJ 18", "date": "2025-06-27", "organization_id": "~{\"classification\": \"lower\"}", "classification": [], "related_entities": []}, {"description": "Enrolled Adopted, VV, (In recess 06/26/2025);  SJ 18", "date": "2025-06-27", "organization_id": "~{\"classification\": \"upper\"}", "classification": ["enrolled"], "related_entities": []}, {"description": "Signed by Governor Ayotte 06/27/2025; Chapter 141; 7/01/2025", "date": "2025-06-30", "organization_id": "~{\"classification\": \"lower\"}", "classification": ["executive-signature"], "related_entities": []}, {"description": "Without Objection, the Clerk is authorized to make technical and administrative corrections which are necessary to reflect the intent of the Senate, MA; 06/05/2025;  SJ 15", "date": "2025-07-08", "organization_id": "~{\"classification\": \"upper\"}", "classification": [], "related_entities": []}], "sponsorships": [{"name": "Kenneth L Weyler", "classification": "primary", "entity_type": "person", "primary": true, "person_id": "~{\"name\": \"Kenneth L Weyler\"}", "organization_id": null}, {"name": "Dan McGuire", "classification": "cosponsor", "entity_type": "person", "primary": false, "person_id": "~{\"name\": \"Dan McGuire\"}", "organization_id": null}, {"name": "Jess Edwards", "classification": "cosponsor", "entity_type": "person", "primary": false, "person_id": "~{\"name\": \"Jess Edwards\"}", "organization_id": null}, {"name": "Keith Erf", "classification": "cosponsor", "entity_type": "person", "primary": false, "person_id": "~{\"name\": \"Keith Erf\"}", "organization_id": null}], "related_bills": [], "versions": [{"note": "Amendment #2025-2900e", "links": [{"url": "https://www.gencourt.state.nh.us/bill_status/legacy/bs2016/billText.aspx?sy=2025&id=2025-2900e&txtFormat=amend", "media_type": "application/pdf"}], "date": "", "classification": ""}], "documents": [], "citations": [], "sources": [{"url": "https://www.gencourt.state.nh.us/bill_status/legacy/bs2016/bill_docket.aspx?lsr=1170&sy=2025&sortoption=&txtsessionyear=2025", "note": ""}, {"url": "https://www.gencourt.state.nh.us/bill_status/legacy/bs2016/bill_status.aspx?lsr=1170&sy=2025&sortoption=&txtsessionyear=2025", "note": ""}], "extras": {"_code": "3089"}, "jurisdiction": {"id": "ocd-jurisdiction/country:us/state:nh/government", "name": "New Hampshire", "classification": "state", "division_id": "ocd-division/country:us/state:nh"}, "scraped_at": "2025-11-27T08:18:26+00:00", "_id": "a2a4f97e-cb69-11f0-8df3-323e7095d164"}