{"legislative_session": "2025", "identifier": "HB1", "title": "making appropriations for the expenses of certain departments of the state for fiscal years ending June 30, 2026 and June 30, 2027.", "from_organization": "~{\"classification\": \"lower\"}", "classification": ["bill"], "subject": [], "abstracts": [], "other_titles": [], "other_identifiers": [], "actions": [{"description": "Introduced (in recess of) 02/20/2025 and referred to Finance  HJ 6  P. 53", "date": "2025-03-03", "organization_id": "~{\"classification\": \"lower\"}", "classification": ["introduction", "referral-committee"], "related_entities": []}, {"description": "Public Hearing: 03/12/2025 02:00 pm SH Reps Hall", "date": "2025-03-05", "organization_id": "~{\"classification\": \"lower\"}", "classification": [], "related_entities": []}, {"description": "==RECESSED== Executive Session: 03/31/2025 10:00 am LOB 210-211", "date": "2025-03-25", "organization_id": "~{\"classification\": \"lower\"}", "classification": [], "related_entities": []}, {"description": "==CONTINUED== Executive Session: 04/03/2025 01:00 pm LOB 210-211", "date": "2025-03-26", "organization_id": "~{\"classification\": \"lower\"}", "classification": [], "related_entities": []}, {"description": "Majority Committee Report: Ought to Pass with Amendment # 2025-1474h   04/03/2025 (Vote 14-11; RC)  HC 19  P. 18", "date": "2025-04-03", "organization_id": "~{\"classification\": \"lower\"}", "classification": ["committee-passage-favorable"], "related_entities": []}, {"description": "Minority Committee Report: Inexpedient to Legislate", "date": "2025-04-03", "organization_id": "~{\"classification\": \"lower\"}", "classification": [], "related_entities": []}, {"description": "Amendment # 2025-1474h: AA RC 197-178 04/10/2025  HJ 12  P. 47", "date": "2025-04-10", "organization_id": "~{\"classification\": \"lower\"}", "classification": [], "related_entities": []}, {"description": "Ought to Pass with Amendment 2025-1474h: MA RC 192-183 04/10/2025  HJ 12  P. 53", "date": "2025-04-10", "organization_id": "~{\"classification\": \"lower\"}", "classification": ["committee-passage-favorable", "passage"], "related_entities": []}, {"description": "Introduced 03/27/2025 and Referred to Finance;  SJ 10", "date": "2025-04-11", "organization_id": "~{\"classification\": \"upper\"}", "classification": ["introduction", "referral-committee"], "related_entities": []}, {"description": "Hearing: 05/06/2025, Room Reps Hall, SH, 01:00 pm;  SC 19", "date": "2025-04-24", "organization_id": "~{\"classification\": \"upper\"}", "classification": [], "related_entities": []}, {"description": "Committee Report: Ought to Pass with Amendment # 2025-2638s, 06/05/2025, Vote 6-2;  SC 24A", "date": "2025-06-03", "organization_id": "~{\"classification\": \"upper\"}", "classification": ["committee-passage-favorable"], "related_entities": []}, {"description": "The Chair ruled the Question Divisible; 06/05/2025;  SJ 15", "date": "2025-06-05", "organization_id": "~{\"classification\": \"upper\"}", "classification": [], "related_entities": []}, {"description": "Sen. Birdsell Objected that the Question is Divisible; 06/05/2025;  SJ 15", "date": "2025-06-05", "organization_id": "~{\"classification\": \"upper\"}", "classification": [], "related_entities": []}, {"description": "Committee Amendment # 2025-2638s, AA, VV; 06/05/2025;  SJ 15", "date": "2025-06-05", "organization_id": "~{\"classification\": \"upper\"}", "classification": [], "related_entities": []}, {"description": "Ought to Pass with Amendment #2025-2638s, RC 15Y-9N, MA; OT3rdg; 06/05/2025;  SJ 15", "date": "2025-06-05", "organization_id": "~{\"classification\": \"upper\"}", "classification": ["committee-passage-favorable", "passage"], "related_entities": []}, {"description": "Special Order to beginning of the regular calendar, Without Objection, MA; 06/05/2025;  SJ 15", "date": "2025-06-05", "organization_id": "~{\"classification\": \"upper\"}", "classification": [], "related_entities": []}, {"description": "Shall the decision of the Chair stand? RC 8Y-16N decision of the Chair overturned, 06/05/2025;  SJ 15", "date": "2025-06-05", "organization_id": "~{\"classification\": \"upper\"}", "classification": [], "related_entities": []}, {"description": "House Non-Concurs with Senate Amendment 2025-2638s and Requests CofC (Rep. Osborne): MA VV 06/05/2025  HJ 16  P. 167", "date": "2025-06-09", "organization_id": "~{\"classification\": \"lower\"}", "classification": [], "related_entities": []}, {"description": "Speaker Appoints: Reps. Weyler, D. McGuire, Sweeney, Cambrils, Wallner 06/05/2025  HJ 16  P. 167", "date": "2025-06-09", "organization_id": "~{\"classification\": \"lower\"}", "classification": [], "related_entities": []}, {"description": "Speaker Appoints Alternates: Reps. Erf, Layon, Edwards, Osborne, Janigian 06/05/2025  HJ 16  P. 167", "date": "2025-06-09", "organization_id": "~{\"classification\": \"lower\"}", "classification": [], "related_entities": []}, {"description": "Sen. Carson Accedes to House Request for Committee of Conference, MA, VV; (In recess 06/05/2025);  SJ 16", "date": "2025-06-09", "organization_id": "~{\"classification\": \"upper\"}", "classification": [], "related_entities": []}, {"description": "President Appoints: Senators Carson, Gray, Rosenwald; (In Recess 06/05/2025);  SJ 16", "date": "2025-06-09", "organization_id": "~{\"classification\": \"upper\"}", "classification": [], "related_entities": []}, {"description": "President Appoints Alternates: Senators Birdsell; (In Recess 06/05/2025);  SJ 16", "date": "2025-06-09", "organization_id": "~{\"classification\": \"upper\"}", "classification": [], "related_entities": []}, {"description": "Conference Committee Meeting: 06/12/2025 02:00 pm LOB 210-211", "date": "2025-06-12", "organization_id": "~{\"classification\": \"lower\"}", "classification": [], "related_entities": []}, {"description": "Conferee Change: Rep. Mooney Replaces Rep. Edwards 06/12/2025  HJ 16  P. 172", "date": "2025-06-12", "organization_id": "~{\"classification\": \"lower\"}", "classification": [], "related_entities": []}, {"description": "Conference Committee Meeting: 06/13/2025 10:00 am LOB 210-211", "date": "2025-06-13", "organization_id": "~{\"classification\": \"lower\"}", "classification": [], "related_entities": []}, {"description": "President Appoints Alternates: Senators Lang; (In Recess 06/12/2025);  SJ 17", "date": "2025-06-12", "organization_id": "~{\"classification\": \"upper\"}", "classification": [], "related_entities": []}, {"description": "President Appoints Alternates: Senators Reardon; (In Recess 06/12/2025);  SJ 17", "date": "2025-06-13", "organization_id": "~{\"classification\": \"upper\"}", "classification": [], "related_entities": []}, {"description": "Conference Committee Meeting: 06/16/2025 10:00 am LOB 210-211", "date": "2025-06-16", "organization_id": "~{\"classification\": \"lower\"}", "classification": [], "related_entities": []}, {"description": "Conferee Change: Rep. Edwards Replaces Rep. Mooney 06/16/2025  HJ 17  P. 22", "date": "2025-06-16", "organization_id": "~{\"classification\": \"lower\"}", "classification": [], "related_entities": []}, {"description": "Conference Committee Meeting: 06/17/2025 10:00 am LOB 210-211", "date": "2025-06-17", "organization_id": "~{\"classification\": \"lower\"}", "classification": [], "related_entities": []}, {"description": "Conference Committee Meeting: 06/17/2025 10:00 am LOB 210-211", "date": "2025-06-17", "organization_id": "~{\"classification\": \"lower\"}", "classification": [], "related_entities": []}, {"description": "Conference Committee Meeting: 06/18/2025 10:00 am LOB 210-211", "date": "2025-06-18", "organization_id": "~{\"classification\": \"lower\"}", "classification": [], "related_entities": []}, {"description": "Conferee Change; Senator Birdsell Replaces Senator Rosenwald;  SJ 17", "date": "2025-06-18", "organization_id": "~{\"classification\": \"upper\"}", "classification": [], "related_entities": []}, {"description": "Conference Committee Meeting: 06/19/2025 10:00 am LOB 210-211", "date": "2025-06-19", "organization_id": "~{\"classification\": \"lower\"}", "classification": [], "related_entities": []}, {"description": "Conferee Change: Rep. Edwards Replaces Rep. Wallner 06/19/2025  HJ 17  P. 26", "date": "2025-06-19", "organization_id": "~{\"classification\": \"lower\"}", "classification": [], "related_entities": []}, {"description": "Conference Committee Report Filed, # 2025-2865c; 06/26/2025", "date": "2025-06-19", "organization_id": "~{\"classification\": \"upper\"}", "classification": [], "related_entities": []}, {"description": "Conference Committee Report 2025-2865c: Failed, RC 182-183 06/26/2025  HJ 18  P. 32", "date": "2025-06-26", "organization_id": "~{\"classification\": \"lower\"}", "classification": [], "related_entities": []}, {"description": "Conference Committee Report # 2025-2865c; RC 16Y-8N, Adopted; 06/26/2025;  SJ 17", "date": "2025-06-26", "organization_id": "~{\"classification\": \"upper\"}", "classification": [], "related_entities": []}, {"description": "Reconsider HB1 (Rep. Taylor): MA RC 185-180 06/26/2025  HJ 18  P. 34", "date": "2025-06-26", "organization_id": "~{\"classification\": \"lower\"}", "classification": [], "related_entities": []}, {"description": "Conference Committee Report 2025-2865c: Adopted, RC 185-180 06/26/2025  HJ 18  P. 38", "date": "2025-06-26", "organization_id": "~{\"classification\": \"lower\"}", "classification": [], "related_entities": []}, {"description": "Enrolled Bill Amendment # 2025-2899e: AA VV (in recess of) 06/26/2025  HJ 18  P. 58", "date": "2025-06-27", "organization_id": "~{\"classification\": \"lower\"}", "classification": [], "related_entities": []}, {"description": "Enrolled Bill Amendment # 2025-2899e Adopted, VV, (In recess of 06/26/2025);  SJ 18", "date": "2025-06-27", "organization_id": "~{\"classification\": \"upper\"}", "classification": ["amendment-passage"], "related_entities": []}, {"description": "Enrolled (in recess of) 06/26/2025  HJ 18", "date": "2025-06-27", "organization_id": "~{\"classification\": \"lower\"}", "classification": [], "related_entities": []}, {"description": "Enrolled Adopted, VV, (In recess 06/26/2025);  SJ 18", "date": "2025-06-27", "organization_id": "~{\"classification\": \"upper\"}", "classification": ["enrolled"], "related_entities": []}, {"description": "Signed by Governor Ayotte 06/27/2025; Chapter 140; eff 07/01/2025", "date": "2025-06-30", "organization_id": "~{\"classification\": \"lower\"}", "classification": ["executive-signature"], "related_entities": []}, {"description": "Without Objection, the Clerk is authorized to make technical and administrative corrections which are necessary to reflect the intent of the Senate, MA; 06/05/2025;  SJ 15", "date": "2025-06-05", "organization_id": "~{\"classification\": \"upper\"}", "classification": [], "related_entities": []}], "sponsorships": [{"name": "Kenneth L Weyler", "classification": "primary", "entity_type": "person", "primary": true, "person_id": "~{\"name\": \"Kenneth L Weyler\"}", "organization_id": null}, {"name": "Dan McGuire", "classification": "cosponsor", "entity_type": "person", "primary": false, "person_id": "~{\"name\": \"Dan McGuire\"}", "organization_id": null}, {"name": "Jess Edwards", "classification": "cosponsor", "entity_type": "person", "primary": false, "person_id": "~{\"name\": \"Jess Edwards\"}", "organization_id": null}, {"name": "Keith Erf", "classification": "cosponsor", "entity_type": "person", "primary": false, "person_id": "~{\"name\": \"Keith Erf\"}", "organization_id": null}], "related_bills": [], "versions": [{"note": "Amendment #2025-2899e", "links": [{"url": "https://www.gencourt.state.nh.us/bill_status/legacy/bs2016/billText.aspx?sy=2025&id=2025-2899e&txtFormat=amend", "media_type": "application/pdf"}], "date": "", "classification": ""}], "documents": [{"note": "amendment 2025-2638s", "links": [{"url": "https://www.gencourt.state.nh.us/legislation/amendments/2025-2638s.html", "media_type": ""}], "date": "", "classification": ""}], "citations": [], "sources": [{"url": "https://www.gencourt.state.nh.us/bill_status/legacy/bs2016/bill_docket.aspx?lsr=1165&sy=2025&sortoption=&txtsessionyear=2025", "note": ""}, {"url": "https://www.gencourt.state.nh.us/bill_status/legacy/bs2016/bill_status.aspx?lsr=1165&sy=2025&sortoption=&txtsessionyear=2025", "note": ""}], "extras": {"_code": "3089"}, "jurisdiction": {"id": "ocd-jurisdiction/country:us/state:nh/government", "name": "New Hampshire", "classification": "state", "division_id": "ocd-division/country:us/state:nh"}, "scraped_at": "2025-11-28T08:17:28+00:00", "_id": "ab14c958-cc32-11f0-b8fb-eae31380e474"}