{"legislative_session": "2025", "identifier": "SB118", "title": "relative to the personal needs allowance of residents of nursing homes; making an appropriation to the department of health and human services for Hampstead hospital and residential treatment facility staff; establishing the Hampstead hospital and residential treatment facility capital investment fund; and permitting qualifying patients and designated caregivers to cultivate cannabis for therapeutic use.", "from_organization": "~{\"classification\": \"upper\"}", "classification": ["bill"], "subject": [], "abstracts": [], "other_titles": [], "other_identifiers": [], "actions": [{"description": "Introduced 01/09/2025 and Referred to Health and Human Services;  SJ 3", "date": "2025-01-22", "organization_id": "~{\"classification\": \"upper\"}", "classification": ["introduction", "referral-committee"], "related_entities": []}, {"description": "Hearing: 02/19/2025, Room 100, SH, 10:00 am;  SC 10", "date": "2025-02-12", "organization_id": "~{\"classification\": \"upper\"}", "classification": [], "related_entities": []}, {"description": "Hearing: 02/19/2025, Room 100, SH, 10:15 am, on proposed amendment # 2025-0295s;  SC 10", "date": "2025-02-12", "organization_id": "~{\"classification\": \"upper\"}", "classification": [], "related_entities": []}, {"description": "Committee Report: Ought to Pass with Amendment # 2025-0529s, 03/06/2025; Vote 5-0; CC;  SC 11", "date": "2025-02-21", "organization_id": "~{\"classification\": \"upper\"}", "classification": ["committee-passage-favorable"], "related_entities": []}, {"description": "Committee Amendment # 2025-0529s, AA, VV; 03/06/2025;  SJ 6", "date": "2025-03-06", "organization_id": "~{\"classification\": \"upper\"}", "classification": [], "related_entities": []}, {"description": "Ought to Pass with Amendment #2025-0529s, MA, VV; Refer to Finance Rule 4-5; 03/06/2025;  SJ 6", "date": "2025-03-06", "organization_id": "~{\"classification\": \"upper\"}", "classification": ["committee-passage-favorable", "passage"], "related_entities": []}, {"description": "Committee Report: Ought to Pass with Amendment # 2025-0941s, 03/20/2025; Vote 6-0; CC;  SC 13", "date": "2025-03-12", "organization_id": "~{\"classification\": \"upper\"}", "classification": ["committee-passage-favorable"], "related_entities": []}, {"description": "Committee Amendment # 2025-0941s, AA, VV; 03/20/2025;  SJ 8", "date": "2025-03-20", "organization_id": "~{\"classification\": \"upper\"}", "classification": [], "related_entities": []}, {"description": "Ought to Pass with Amendment #2025-0941s, MA, VV; OT3rdg; 03/20/2025;  SJ 8", "date": "2025-03-20", "organization_id": "~{\"classification\": \"upper\"}", "classification": ["committee-passage-favorable", "passage"], "related_entities": []}, {"description": "Introduced (in recess of) 03/27/2025 and referred to Health, Human Services and Elderly Affairs  HJ 11  P. 111", "date": "2025-03-28", "organization_id": "~{\"classification\": \"lower\"}", "classification": ["introduction", "referral-committee"], "related_entities": []}, {"description": "Public Hearing: 04/09/2025 11:00 am LOB 301-303", "date": "2025-04-01", "organization_id": "~{\"classification\": \"lower\"}", "classification": [], "related_entities": []}, {"description": "Executive Session: 04/30/2025 09:30 am LOB 205-207", "date": "2025-04-23", "organization_id": "~{\"classification\": \"lower\"}", "classification": [], "related_entities": []}, {"description": "Committee Report: Ought to Pass with Amendment # 2025-1871h (NT)  04/30/2025 (Vote 18-0; CC)  HC 23  P. 8", "date": "2025-05-01", "organization_id": "~{\"classification\": \"lower\"}", "classification": ["committee-passage-favorable"], "related_entities": []}, {"description": "Amendment # 2025-1871h (NT): AA VV 05/08/2025  HJ 14  P. 7", "date": "2025-05-08", "organization_id": "~{\"classification\": \"lower\"}", "classification": [], "related_entities": []}, {"description": "Ought to Pass with Amendment 2025-1871h: MA VV 05/08/2025  HJ 14  P. 10", "date": "2025-05-08", "organization_id": "~{\"classification\": \"lower\"}", "classification": ["committee-passage-favorable", "passage"], "related_entities": []}, {"description": "Referred to Finance 05/08/2025  HJ 14  P. 10", "date": "2025-05-08", "organization_id": "~{\"classification\": \"lower\"}", "classification": ["referral-committee"], "related_entities": []}, {"description": "Division III Work Session: 05/20/2025 10:00 am LOB 210-211", "date": "2025-05-14", "organization_id": "~{\"classification\": \"lower\"}", "classification": [], "related_entities": []}, {"description": "Executive Session: 05/28/2025 10:00 am LOB 210-211", "date": "2025-05-20", "organization_id": "~{\"classification\": \"lower\"}", "classification": [], "related_entities": []}, {"description": "Executive Session: 05/22/2025 03:00 pm LOB 210-211", "date": "2025-05-22", "organization_id": "~{\"classification\": \"lower\"}", "classification": [], "related_entities": []}, {"description": "Majority Committee Report: Ought to Pass  05/29/2025 (Vote 18-7; RC)  HC 27  P. 21", "date": "2025-05-29", "organization_id": "~{\"classification\": \"lower\"}", "classification": ["committee-passage-favorable"], "related_entities": []}, {"description": "Minority Committee Report: Ought to Pass with Amendment # 2025-2345h", "date": "2025-05-29", "organization_id": "~{\"classification\": \"lower\"}", "classification": ["committee-passage-favorable"], "related_entities": []}, {"description": "Amendment # 2025-2345h: AF DV 103-215 06/05/2025  HJ 16  P. 154", "date": "2025-06-05", "organization_id": "~{\"classification\": \"lower\"}", "classification": [], "related_entities": []}, {"description": "Ought to Pass: MA VV 06/05/2025  HJ 16  P. 155", "date": "2025-06-05", "organization_id": "~{\"classification\": \"lower\"}", "classification": ["committee-passage-favorable", "passage"], "related_entities": []}, {"description": "Sen. Rochefort Moved Nonconcur with the House Amendment; Requests C of C, MA, VV; (In Recess 06/05/2025);  SJ 16", "date": "2025-06-11", "organization_id": "~{\"classification\": \"upper\"}", "classification": [], "related_entities": []}, {"description": "President Appoints: Senators Rochefort, Birdsell, Prentiss; (In Recess 06/05/2025);  SJ 16", "date": "2025-06-11", "organization_id": "~{\"classification\": \"upper\"}", "classification": [], "related_entities": []}, {"description": "House Accedes to Senate Request for CofC (Rep. Kofalt): MA VV 06/05/2025  HJ 16  P. 171", "date": "2025-06-11", "organization_id": "~{\"classification\": \"lower\"}", "classification": [], "related_entities": []}, {"description": "Speaker Appoints: Reps. W. MacDonald, Weber, Drew, Kesselring 06/05/2025  HJ 16  P. 171", "date": "2025-06-11", "organization_id": "~{\"classification\": \"lower\"}", "classification": [], "related_entities": []}, {"description": "==RECESSED== Committee of Conference Meeting: 06/16/2025, 11:00 am, Room 103, SH", "date": "2025-06-12", "organization_id": "~{\"classification\": \"upper\"}", "classification": [], "related_entities": []}, {"description": "Conferee Change: Rep. Telerski Replaces Rep. Weber 06/13/2025  HJ 17  P. 22", "date": "2025-06-13", "organization_id": "~{\"classification\": \"lower\"}", "classification": [], "related_entities": []}, {"description": "Conferee Change: Rep. M. Pearson Replaces Rep. Kesselring 06/16/2025  HJ 17  P. 24", "date": "2025-06-16", "organization_id": "~{\"classification\": \"lower\"}", "classification": [], "related_entities": []}, {"description": "==RECONVENE== Committee of Conference Meeting: 06/18/2025, 12:00 pm, Room 100, SH", "date": "2025-06-16", "organization_id": "~{\"classification\": \"upper\"}", "classification": [], "related_entities": []}, {"description": "Conferee Change: Rep. S. Smith Replaces Rep. Telerski 06/18/2025  HJ 17  P. 25", "date": "2025-06-18", "organization_id": "~{\"classification\": \"lower\"}", "classification": [], "related_entities": []}, {"description": "Conference Committee Report # 2025-2847c Filed 06/19/2025; House Amendment + New Amendment  HJ 17", "date": "2025-06-19", "organization_id": "~{\"classification\": \"lower\"}", "classification": [], "related_entities": []}, {"description": "Conference Committee Report 2025-2847c: Adopted, VV 06/26/2025  HJ 18  P. 2", "date": "2025-06-26", "organization_id": "~{\"classification\": \"lower\"}", "classification": [], "related_entities": []}, {"description": "Conference Committee Report # 2025-2847c, Adopted, VV; 06/26/2025;  SJ 17", "date": "2025-06-24", "organization_id": "~{\"classification\": \"upper\"}", "classification": [], "related_entities": []}, {"description": "Enrolled Adopted, VV, (In recess 06/26/2025);  SJ 18", "date": "2025-07-18", "organization_id": "~{\"classification\": \"upper\"}", "classification": ["enrolled"], "related_entities": []}, {"description": "Enrolled (in recess of) 06/26/2025  HJ 18  P. 64", "date": "2025-07-18", "organization_id": "~{\"classification\": \"lower\"}", "classification": [], "related_entities": []}, {"description": "Signed by the Governor on 08/01/2025; Chapter 0295", "date": "2025-08-04", "organization_id": "~{\"classification\": \"upper\"}", "classification": ["executive-signature"], "related_entities": []}, {"description": "I. Section 1 Effective 01/01/2026", "date": "2025-08-04", "organization_id": "~{\"classification\": \"upper\"}", "classification": [], "related_entities": []}, {"description": "II. Section 2 Effective 07/01/2025", "date": "2025-08-04", "organization_id": "~{\"classification\": \"upper\"}", "classification": [], "related_entities": []}, {"description": "III. Remainder Effective 06/30/2025", "date": "2025-08-04", "organization_id": "~{\"classification\": \"upper\"}", "classification": [], "related_entities": []}], "sponsorships": [{"name": "Lucy McVitty Weber", "classification": "cosponsor", "entity_type": "person", "primary": false, "person_id": "~{\"name\": \"Lucy McVitty Weber\"}", "organization_id": null}, {"name": "Regina Birdsell", "classification": "primary", "entity_type": "person", "primary": true, "person_id": "~{\"name\": \"Regina Birdsell\"}", "organization_id": null}, {"name": "Kevin A. Avard", "classification": "cosponsor", "entity_type": "person", "primary": false, "person_id": "~{\"name\": \"Kevin A. Avard\"}", "organization_id": null}, {"name": "Cindy Rosenwald", "classification": "cosponsor", "entity_type": "person", "primary": false, "person_id": "~{\"name\": \"Cindy Rosenwald\"}", "organization_id": null}, {"name": "Suzanne M. Prentiss", "classification": "cosponsor", "entity_type": "person", "primary": false, "person_id": "~{\"name\": \"Suzanne M. Prentiss\"}", "organization_id": null}, {"name": "Wayne D. MacDonald", "classification": "cosponsor", "entity_type": "person", "primary": false, "person_id": "~{\"name\": \"Wayne D. MacDonald\"}", "organization_id": null}], "related_bills": [], "versions": [{"note": "Amendment #2025-2345h", "links": [{"url": "https://www.gencourt.state.nh.us/bill_status/legacy/bs2016/billText.aspx?sy=2025&id=2025-2345h&txtFormat=amend", "media_type": "application/pdf"}], "date": "", "classification": ""}], "documents": [{"note": "amendment 2025-0529s", "links": [{"url": "https://www.gencourt.state.nh.us/legislation/amendments/2025-0529s.html", "media_type": ""}], "date": "", "classification": ""}, {"note": "amendment 2025-0941s", "links": [{"url": "https://www.gencourt.state.nh.us/legislation/amendments/2025-0941s.html", "media_type": ""}], "date": "", "classification": ""}], "citations": [], "sources": [{"url": "https://www.gencourt.state.nh.us/bill_status/legacy/bs2016/bill_docket.aspx?lsr=0349&sy=2025&sortoption=&txtsessionyear=2025", "note": ""}, {"url": "https://www.gencourt.state.nh.us/bill_status/legacy/bs2016/bill_status.aspx?lsr=0349&sy=2025&sortoption=&txtsessionyear=2025", "note": ""}], "extras": {"_code": "3008"}, "jurisdiction": {"id": "ocd-jurisdiction/country:us/state:nh/government", "name": "New Hampshire", "classification": "state", "division_id": "ocd-division/country:us/state:nh"}, "scraped_at": "2025-11-29T08:15:09+00:00", "_id": "843c3c84-ccfb-11f0-ae28-6658c1d13282"}